{
  "$schema": "../../schema.json",
  "name": "USDT (Bridged)",
  "symbol": "CUSDT",
  "icon": "logo.png",
  "decimal": 8,
  "tags": null,
  "manager": "ckb1qyqxu8gd0mjkvraz774zkgj3p4ks7mx4fp8sm5rft9",
  "type": {
    "codeHash": "0x5e7a36a77e68eecc013dfa2fe6a23f3b6c344b04005808694ae6dd45eea4cfd5",
    "hashType": "type",
    "args": "0xf951c4f35aabb9b23dff18b1c7e433801ff6d94430d180335082cc65373d1220"
  },
  "typeHash": "0x73cb97e31030f26299f73d4afb38e4b8ab241adad11c8f1b8fd81727ea3b6b36",
  "description": "USDT is a stablecoin (stable-value cryptocurrency) that mirrors the price of the U.S. dollar, issued by a Hong Kong-based company Tether. The tokenâ€™s peg to the USD is achieved via maintaining a sum of dollars in reserves that is equal to the number of USDT in circulation.  CKB-USDT is backed 1:1 with the official ETH-USDT, endorsed by Bitpie.",
  "udtType": "sudt",
  "published": true,
  "email": "ckb-explorer@magickbase.com",
  "famous": true,
  "operatorWebsite": "https://bitpie.com/"
}