{
  "$schema": "../../schema.json",
  "name": "BTB",
  "symbol": "BTB",
  "icon": null,
  "decimal": 8,
  "tags": null,
  "manager": "ckt1qzpfq3n62yh9hxnts9jxnv8d4wap7jkywn3gllwkqnp203myg6a67q4exx4fhs3tc6wdgzltlrtx38ve65v2w0mr3k86c9qt25u8h3nw6sqqqqqqss9e0m",
  "type": {
    "codeHash": "0x25c29dc317811a6f6f3985a7a9ebc4838bd388d19d0feeecf0bcd60f6c0975bb",
    "hashType": "type",
    "args": "0xcd32471a878127270f348ced2cf59a06d8a083c0dd909c678f2db17a0100da9a"
  },
  "typeHash": "0x0c3beaf6d33f36b742260930a61a47b4efb611d31a1f4668d508c817caa8df44",
  "description": null,
  "udtType": "xudt",
  "published": true,
  "email": null,
  "famous": false,
  "operatorWebsite": null
}