{
  "$schema": "../../schema.json",
  "name": "DAI",
  "symbol": "DAI",
  "icon": "https://cryptologos.cc/logos/multi-collateral-dai-dai-logo.svg?v=002",
  "decimal": 18,
  "tags": null,
  "manager": "ckb1qzfmc753t57clzuk0z7xc7sh29ecexwwdenthfxl4dtxwtmddytcjq2lqqqqqyqqqqqrqqqqqqcsqqqqchlf5xgdn70phzppj99mzlgumxjr9p4q5fh5ccee0nda4dn0uxxsz2sqqqqrq7pkggcnwdf5xu6y2wpexqungse5x3zxzwfcvgun2dz9v4jx2s2rxsun2v3hx9jrq3sh79ghw",
  "type": {
    "codeHash": "0x5e7a36a77e68eecc013dfa2fe6a23f3b6c344b04005808694ae6dd45eea4cfd5",
    "hashType": "type",
    "args": "0xdd97fe4f673ed231af188855f4ca8b1034153c8d4e40f5b4fae2afd5d3f53ccc"
  },
  "typeHash": "0x6c8fa633bfd8887ff1371fa6219e9a26b68d29aa37cb1e4fde639de0a82f5f28",
  "description": null,
  "udtType": "sudt",
  "published": true,
  "email": "ckb-explorer@magickbase.com",
  "famous": true,
  "operatorWebsite": null
}