{
  "$schema": "../../schema.json",
  "name": "CKB Fist Inscription",
  "symbol": "CKBI",
  "icon": null,
  "decimal": 8,
  "tags": null,
  "manager": "ckt1qrfrwcdnvssswdwpn3s9v8fp87emat306ctjwsm3nmlkjg8qyza2cqgqqyd4v3ahg7q2squ9py3wwf80t8y2dhpl0quppefz",
  "type": {
    "codeHash": "0x25c29dc317811a6f6f3985a7a9ebc4838bd388d19d0feeecf0bcd60f6c0975bb",
    "hashType": "type",
    "args": "0x6a5a8762fc76d5854e69d8a13611acfede063e77d15e964e3a88660e86cff1af"
  },
  "typeHash": "0x2d22b97048f5ed3873496016cad8a8b835ade08e926dadb376e13c27c7f7fbd0",
  "description": null,
  "udtType": "omiga_inscription",
  "published": true,
  "email": null,
  "famous": false,
  "operatorWebsite": null
}