{
  "$schema": "../../schema.json",
  "name": "fxxxxxx",
  "symbol": "FXXXX",
  "icon": null,
  "decimal": 8,
  "tags": null,
  "manager": "ckt1qzda0cr08m85hc8jlnfp3zer7xulejywt49kt2rr0vthywaa50xwsq0xlehxvjeu5n0khdz3gvkavd0n429sthcdv0g8c",
  "type": {
    "codeHash": "0x25c29dc317811a6f6f3985a7a9ebc4838bd388d19d0feeecf0bcd60f6c0975bb",
    "hashType": "type",
    "args": "0xf9563d302da153c7f4ddf19fc9a321b77eb4812e2e05c1e29dfefb39d0f886b6"
  },
  "typeHash": "0x0f630dc10c6eef4689ca456cd4bfc6ae29141f0eef0ae56823edcda669003b89",
  "description": null,
  "udtType": "xudt",
  "published": true,
  "email": null,
  "famous": false,
  "operatorWebsite": null
}