{
  "$schema": "../../schema.json",
  "name": "BTB",
  "symbol": "BTB",
  "icon": null,
  "decimal": 8,
  "tags": null,
  "manager": "ckt1qzpfq3n62yh9hxnts9jxnv8d4wap7jkywn3gllwkqnp203myg6a67qkp6v46cc5e4adpf5jq5u99d8eupm6sxg2d2zxmhkp0jprhntkdfyqqqqqqss779e",
  "type": {
    "codeHash": "0x25c29dc317811a6f6f3985a7a9ebc4838bd388d19d0feeecf0bcd60f6c0975bb",
    "hashType": "type",
    "args": "0xe95e448bec6094276317b40e0b69bf825a7844882d9fe936c817152077605821"
  },
  "typeHash": "0x01093ffe54763822cd7d4beedba111f68a47fcd38bf3959cc03b0929b2816570",
  "description": null,
  "udtType": "xudt",
  "published": true,
  "email": null,
  "famous": false,
  "operatorWebsite": null
}