{
  "$schema": "../../schema.json",
  "name": null,
  "symbol": "LP-UTXOSwap V1",
  "icon": null,
  "decimal": 8,
  "tags": null,
  "manager": "ckb1qrgqep8saj8agswr30pls73hra28ry8jlnlc3ejzh3dl2ju7xxpjxqgqq9v98gvvhzqf8p4xfwnkn8vw4v39jpxy35js8kc3",
  "type": {
    "codeHash": "0x50bd8d6680b8b9cf98b73f3c08faf8b2a21914311954118ad6609be6e78a1b95",
    "hashType": "data1",
    "args": "0x9c1f7b8d38415b95236017342ec3c0b032011bf07476250e131d5f46923ba09400000040"
  },
  "typeHash": "0x6f07e3411ed4c39a725828a78727d03814945b4962b976ead9e3831961922b3d",
  "description": null,
  "udtType": "xudt",
  "published": true,
  "email": null,
  "famous": false,
  "operatorWebsite": null
}