{
  "$schema": "../../schema.json",
  "name": "QL Test Token7",
  "symbol": "QLT7",
  "icon": null,
  "decimal": 8,
  "tags": null,
  "manager": "ckt1qzda0cr08m85hc8jlnfp3zer7xulejywt49kt2rr0vthywaa50xwsqgjetwv0ym8spejhxzaj6g0lqqrrnas4sglswsxy",
  "type": {
    "codeHash": "0x25c29dc317811a6f6f3985a7a9ebc4838bd388d19d0feeecf0bcd60f6c0975bb",
    "hashType": "type",
    "args": "0x5f85a13c404c69dc7f0c1a35559d8c8bd6919e88f008d420a71acc25720d5a70"
  },
  "typeHash": "0xe0c513ff5302f3cfd3b4c7bbc052200a39cb8a9e7985d9081cac088e2fa807be",
  "description": null,
  "udtType": "xudt",
  "published": true,
  "email": null,
  "famous": false,
  "operatorWebsite": null
}