{
  "$schema": "../../schema.json",
  "name": "BTB",
  "symbol": "BTB",
  "icon": null,
  "decimal": 8,
  "tags": null,
  "manager": "ckt1qzpfq3n62yh9hxnts9jxnv8d4wap7jkywn3gllwkqnp203myg6a67q4mjqmq2jp0ysp0z8c5mr4ja5rslvahu2j9e57rctkp9amhmy93gqqqqqqqw7jvh5",
  "type": {
    "codeHash": "0x25c29dc317811a6f6f3985a7a9ebc4838bd388d19d0feeecf0bcd60f6c0975bb",
    "hashType": "type",
    "args": "0x45cfdb26d1b9820ddf2ddada9887412d62e3aa6e6c56818aaaf4dfdf84b81f3f"
  },
  "typeHash": "0x68fca049a8472f1fd0405b4a62f39421b7bb33d1fd1a1b647076d690d8739631",
  "description": null,
  "udtType": "xudt",
  "published": true,
  "email": null,
  "famous": false,
  "operatorWebsite": null
}