{
  "$schema": "../../schema.json",
  "name": "BTB",
  "symbol": "BTB",
  "icon": null,
  "decimal": 8,
  "tags": null,
  "manager": "ckt1qzpfq3n62yh9hxnts9jxnv8d4wap7jkywn3gllwkqnp203myg6a67q4se69wkfmmky0n7wsrvzgdt00hkugahlu5wnhzv3j5908ysel48sqqqqqqfzw3r8",
  "type": {
    "codeHash": "0x25c29dc317811a6f6f3985a7a9ebc4838bd388d19d0feeecf0bcd60f6c0975bb",
    "hashType": "type",
    "args": "0x9c359a6f928688ff8b30c99205a3cf471ca3aaf4a5e760e2c27eef321d3b5bf5"
  },
  "typeHash": "0x971f5472ef2efd41c1e6606ec5ac419cd6f987295788cc9f60737daff535ea34",
  "description": null,
  "udtType": "xudt",
  "published": true,
  "email": null,
  "famous": false,
  "operatorWebsite": null
}