{
  "$schema": "../../schema.json",
  "name": "BTB",
  "symbol": "BTB",
  "icon": null,
  "decimal": 8,
  "tags": null,
  "manager": "ckt1qzpfq3n62yh9hxnts9jxnv8d4wap7jkywn3gllwkqnp203myg6a67qk7um3aq5447ff6vffdffxwpjyyl4w48rnp9sqytce69ss8xakml5qqqqqqmlevfsckt1qzpfq3n62yh9hxnts9jxnv8d4wap7jkywn3gllwkqnp203myg6a67qk7um3aq5447ff6vffdffxwpjyyl4w48rnp9sqytce69ss8xakml5qqqqqqmlevfs",
  "type": {
    "codeHash": "0x25c29dc317811a6f6f3985a7a9ebc4838bd388d19d0feeecf0bcd60f6c0975bb",
    "hashType": "type",
    "args": "0xe197214ef8f5fffba6326731cdd2908828ecddbf9a5bdae0a7dfcc17d6254bb6"
  },
  "typeHash": "0x3b8c3a627ebfee83abce0f06a25ddba893a730861f91a42b8cec39ee589d2b3d",
  "description": null,
  "udtType": "xudt",
  "published": true,
  "email": null,
  "famous": false,
  "operatorWebsite": null
}