{
  "$schema": "../../schema.json",
  "name": "BTB",
  "symbol": "BTB",
  "icon": null,
  "decimal": 8,
  "tags": null,
  "manager": "ckt1qzpfq3n62yh9hxnts9jxnv8d4wap7jkywn3gllwkqnp203myg6a67q5ejpmh453xkfslh62fc33qjr9vru8cn4lsg7aewxwym7pksy6xysqqqqqqeree28",
  "type": {
    "codeHash": "0x25c29dc317811a6f6f3985a7a9ebc4838bd388d19d0feeecf0bcd60f6c0975bb",
    "hashType": "type",
    "args": "0x214b25f6f33f5fda6e2447f3c8409ab13dfac694110541554a0798cece68f609"
  },
  "typeHash": "0xa2b239722e342a4f9f5d9cdbaac6c77b0e489808dc5cf095651cf5aebd65206f",
  "description": null,
  "udtType": "xudt",
  "published": true,
  "email": null,
  "famous": false,
  "operatorWebsite": null
}